{
  "schema_version": 1,
  "project_name": "smoke_photo_bridge_v3",
  "purpose_choice": "copy_original",
  "purpose_confirmed": true,
  "purpose_confirmation_ref": "SYNTHETIC engineering fixture; not user approval",
  "layout_confirmed": true,
  "layout_confirmation_ref": "SYNTHETIC confirmed finite layout for connection test",
  "canvas_px": [
    1280,
    720
  ],
  "slide_count": 2,
  "font_choice": {
    "family": "Pretendard",
    "basis": "design",
    "source_font_identity_verified": false,
    "confirmation_ref": "SYNTHETIC OFL font choice; not identification of original font"
  },
  "pages": [
    {
      "title": "합성 검증 · 운영 지표",
      "source": {
        "file": "source-1.png",
        "sha256": "5e360815260ba7b8e55be63175c595435fee55c88a824fd8d05897d18c880779",
        "pixel_size": [
          1280,
          800
        ],
        "input_type": ".png",
        "review_origin": "local_model_visual_analysis",
        "visual_review_ref": "SYNTHETIC source visual inspection in current connection test"
      },
      "observations": {
        "schema_version": 1,
        "source_sha256": "5e360815260ba7b8e55be63175c595435fee55c88a824fd8d05897d18c880779",
        "pixels_inspected": true,
        "screen_region_px": [
          0,
          40,
          1280,
          720
        ],
        "slide_aspect_ratio": 1.7777777777777777,
        "items": [
          {
            "element_id": "page-title",
            "property": "geometry_px",
            "value": [
              60,
              82,
              1000,
              56
            ],
            "basis": "visual_estimate",
            "certainty": "estimated",
            "source_bounds_px": [
              60,
              82,
              1000,
              56
            ],
            "render_as": "native_editable"
          },
          {
            "element_id": "page-title",
            "property": "text",
            "value": "합성 검증 · 운영 지표",
            "basis": "visible_text",
            "certainty": "observed",
            "source_bounds_px": [
              60,
              82,
              1000,
              56
            ],
            "render_as": "native_editable"
          },
          {
            "element_id": "page-title",
            "property": "font_family",
            "value": null,
            "basis": "unknown",
            "certainty": "unverified",
            "source_bounds_px": [
              60,
              82,
              1000,
              56
            ],
            "render_as": "native_editable"
          },
          {
            "element_id": "page-title",
            "property": "font_size_pt",
            "value": 20,
            "basis": "user_instruction",
            "certainty": "confirmed",
            "source_bounds_px": [
              60,
              82,
              1000,
              56
            ],
            "render_as": "native_editable",
            "source_ref": "SYNTHETIC fixture requirement only"
          },
          {
            "element_id": "disclosure",
            "property": "geometry_px",
            "value": [
              60,
              145,
              1000,
              40
            ],
            "basis": "visual_estimate",
            "certainty": "estimated",
            "source_bounds_px": [
              60,
              145,
              1000,
              40
            ],
            "render_as": "native_editable"
          },
          {
            "element_id": "disclosure",
            "property": "text",
            "value": "모든 수치와 문구는 연결 검증용 합성자료입니다",
            "basis": "visible_text",
            "certainty": "observed",
            "source_bounds_px": [
              60,
              145,
              1000,
              40
            ],
            "render_as": "native_editable"
          },
          {
            "element_id": "disclosure",
            "property": "font_family",
            "value": null,
            "basis": "unknown",
            "certainty": "unverified",
            "source_bounds_px": [
              60,
              145,
              1000,
              40
            ],
            "render_as": "native_editable"
          },
          {
            "element_id": "disclosure",
            "property": "font_size_pt",
            "value": 10,
            "basis": "user_instruction",
            "certainty": "confirmed",
            "source_bounds_px": [
              60,
              145,
              1000,
              40
            ],
            "render_as": "native_editable",
            "source_ref": "SYNTHETIC fixture requirement only"
          },
          {
            "element_id": "section-left",
            "property": "geometry_px",
            "value": [
              60,
              220,
              540,
              48
            ],
            "basis": "visual_estimate",
            "certainty": "estimated",
            "source_bounds_px": [
              60,
              220,
              540,
              48
            ],
            "render_as": "native_editable"
          },
          {
            "element_id": "section-right",
            "property": "geometry_px",
            "value": [
              660,
              220,
              560,
              48
            ],
            "basis": "visual_estimate",
            "certainty": "estimated",
            "source_bounds_px": [
              660,
              220,
              560,
              48
            ],
            "render_as": "native_editable"
          },
          {
            "element_id": "section-left-label",
            "property": "geometry_px",
            "value": [
              82,
              228,
              495,
              36
            ],
            "basis": "visual_estimate",
            "certainty": "estimated",
            "source_bounds_px": [
              82,
              228,
              495,
              36
            ],
            "render_as": "native_editable"
          },
          {
            "element_id": "section-left-label",
            "property": "text",
            "value": "운영 결과",
            "basis": "visible_text",
            "certainty": "observed",
            "source_bounds_px": [
              82,
              228,
              495,
              36
            ],
            "render_as": "native_editable"
          },
          {
            "element_id": "section-left-label",
            "property": "font_family",
            "value": null,
            "basis": "unknown",
            "certainty": "unverified",
            "source_bounds_px": [
              82,
              228,
              495,
              36
            ],
            "render_as": "native_editable"
          },
          {
            "element_id": "section-left-label",
            "property": "font_size_pt",
            "value": 14,
            "basis": "user_instruction",
            "certainty": "confirmed",
            "source_bounds_px": [
              82,
              228,
              495,
              36
            ],
            "render_as": "native_editable",
            "source_ref": "SYNTHETIC fixture requirement only"
          },
          {
            "element_id": "section-right-label",
            "property": "geometry_px",
            "value": [
              682,
              228,
              515,
              36
            ],
            "basis": "visual_estimate",
            "certainty": "estimated",
            "source_bounds_px": [
              682,
              228,
              515,
              36
            ],
            "render_as": "native_editable"
          },
          {
            "element_id": "section-right-label",
            "property": "text",
            "value": "다음 과제",
            "basis": "visible_text",
            "certainty": "observed",
            "source_bounds_px": [
              682,
              228,
              515,
              36
            ],
            "render_as": "native_editable"
          },
          {
            "element_id": "section-right-label",
            "property": "font_family",
            "value": null,
            "basis": "unknown",
            "certainty": "unverified",
            "source_bounds_px": [
              682,
              228,
              515,
              36
            ],
            "render_as": "native_editable"
          },
          {
            "element_id": "section-right-label",
            "property": "font_size_pt",
            "value": 14,
            "basis": "user_instruction",
            "certainty": "confirmed",
            "source_bounds_px": [
              682,
              228,
              515,
              36
            ],
            "render_as": "native_editable",
            "source_ref": "SYNTHETIC fixture requirement only"
          },
          {
            "element_id": "metric-left",
            "property": "geometry_px",
            "value": [
              60,
              304,
              535,
              40
            ],
            "basis": "visual_estimate",
            "certainty": "estimated",
            "source_bounds_px": [
              60,
              304,
              535,
              40
            ],
            "render_as": "native_editable"
          },
          {
            "element_id": "metric-left",
            "property": "text",
            "value": "처리 건수  120건",
            "basis": "visible_text",
            "certainty": "observed",
            "source_bounds_px": [
              60,
              304,
              535,
              40
            ],
            "render_as": "native_editable"
          },
          {
            "element_id": "metric-left",
            "property": "font_family",
            "value": null,
            "basis": "unknown",
            "certainty": "unverified",
            "source_bounds_px": [